{
  "contractVersion": 1,
  "secret_key": "AAECAwQFBgcICQoLDA0ODxAREhMUFRYXGBkaGxwdHh8",
  "note": "Vygenerováno scripts/generate-fixtures.ts. Pozitivní vektory se ověřují proti hodnotám z části 1, kapitoly 4.10.3.",
  "positive": [
    {
      "id": "TK-P1",
      "type": "o",
      "key_id": 1,
      "fields": {
        "workspace_id": "0192f3a0-1c2d-7e40-9a1b-2c3d4e5f6071",
        "message_id": "0192f3a0-1c2d-7e41-8b2c-3d4e5f607182",
        "message_created_at": 1784995200
      },
      "sides": ["ts", "go"],
      "expected_token": "t1bwEBkvOgHC1-QJobLD1OX2BxAZLzoBwtfkGLLD1OX2Bxgmpk3YDUjmcTwPYu1Q9cpqmSPs4g",
      "expected_mac_full": "d48e6713c0f62ed50f5ca6a9923ece20c1aa4f25d47e9ab6938c8d86d6eac5b5"
    },
    {
      "id": "TK-P2",
      "type": "c",
      "key_id": 1,
      "fields": {
        "workspace_id": "0192f3a0-1c2d-7e40-9a1b-2c3d4e5f6071",
        "message_id": "0192f3a0-1c2d-7e41-8b2c-3d4e5f607182",
        "link_id": "0192f3a0-1c2d-7e42-9c3d-4e5f60718293",
        "message_created_at": 1784995200
      },
      "sides": ["ts", "go"],
      "expected_token": "t1YwEBkvOgHC1-QJobLD1OX2BxAZLzoBwtfkGLLD1OX2BxggGS86AcLX5CnD1OX2BxgpNqZN2Aa8TprBxqhsgbR6l5AMMNpw",
      "expected_mac_full": "6bc4e9ac1c6a86c81b47a97900c30da707294b163b6b84cdb238b9f88551ea2f"
    },
    {
      "id": "TK-P3",
      "type": "i",
      "key_id": 1,
      "fields": {
        "workspace_id": "0192f3a0-1c2d-7e40-9a1b-2c3d4e5f6071",
        "contact_id": "0192f3a0-1c2d-7e43-8d4e-5f60718293a4",
        "campaign_id": "0192f3a0-1c2d-7e44-9e5f-60718293a4b5",
        "nonce": "0011223344556677",
        "expires_at": 1785000600
      },
      "sides": ["ts"],
      "expected_token": "t1aQEBkvOgHC1-QJobLD1OX2BxAZLzoBwtfkONTl9gcYKTpAGS86AcLX5Enl9gcYKTpLUAESIzRFVmd2pk8pg7wFifQiBnNoxotJQLmO2S",
      "expected_mac_full": "3bc0589f422067368c68b4940b98ed927cd9e33ec10058360f4af12a5d8d02f2"
    },
    {
      "id": "TK-P4",
      "type": "u",
      "key_id": 1,
      "fields": {
        "workspace_id": "0192f3a0-1c2d-7e40-9a1b-2c3d4e5f6071",
        "message_id": "0192f3a0-1c2d-7e41-8b2c-3d4e5f607182",
        "contact_id": "0192f3a0-1c2d-7e43-8d4e-5f60718293a4",
        "list_id": "0192f3a0-1c2d-7e45-8f60-718293a4b5c6",
        "message_created_at": 1784995200
      },
      "sides": ["ts", "go"],
      "expected_token": "t1dQEBkvOgHC1-QJobLD1OX2BxAZLzoBwtfkGLLD1OX2BxggGS86AcLX5DjU5fYHGCk6QBkvOgHC1-RY9gcYKTpLXGamTdgE4PEWHmqWZZuZDCD6L2SMw",
      "expected_mac_full": "4e0f1161e6a96659b990c20fa2f648cc75bc9dd3bfaefc4f1a0ab35031e5dc9a"
    },
    {
      "id": "TK-P5",
      "type": "u",
      "key_id": 1,
      "fields": {
        "workspace_id": "0192f3a0-1c2d-7e40-9a1b-2c3d4e5f6071",
        "message_id": "0192f3a0-1c2d-7e41-8b2c-3d4e5f607182",
        "contact_id": "0192f3a0-1c2d-7e43-8d4e-5f60718293a4",
        "list_id": "00000000-0000-0000-0000-000000000000",
        "message_created_at": 1784995200
      },
      "sides": ["ts", "go"],
      "expected_token": "t1dQEBkvOgHC1-QJobLD1OX2BxAZLzoBwtfkGLLD1OX2BxggGS86AcLX5DjU5fYHGCk6QAAAAAAAAAAAAAAAAAAAAAamTdgLfjJDF8FrY9mr1K2TawYXw",
      "expected_mac_full": "b7e324317c16b63d9abd4ad936b0617c473dc9735bfaa846dc42711708dccf21"
    }
  ],
  "negative": [
    {
      "id": "TK-N1",
      "token": "bwEBkvOgHC1-QJobLD1OX2BxAZLzoBwtfkGLLD1OX2Bxgmpk3YDUjmcTwPYu1Q9cpqmSPs4g",
      "endpoint_type": "o",
      "expected_error": "token_malformed",
      "sides": ["ts"]
    },
    {
      "id": "TK-N2",
      "token": "t1bwEBkvOgHC1-QJobLD1OX2BxAZLzoBwtfkGLLD1OX2Bxgmpk3YDUjmcTwPYu1Q9cpqmSPs4A",
      "endpoint_type": "o",
      "expected_error": "token_signature_invalid",
      "sides": ["ts"]
    },
    {
      "id": "TK-N3",
      "token": "t1bwEBkvOgHC1-QJobLD1OX2BxAZLzoBwtfkGLLD1OX2Bxgmpk3YDUjmcTwPYu1Q9cpqmSPs4g",
      "endpoint_type": "c",
      "expected_error": "token_type_mismatch",
      "sides": ["ts"]
    },
    {
      "id": "TK-N4",
      "token": "t1bwkBkvOgHC1-QJobLD1OX2BxAZLzoBwtfkGLLD1OX2Bxgmpk3YA_irEuWOqG2xSBoDldRFBJ",
      "endpoint_type": "o",
      "expected_error": "token_unknown_key",
      "sides": ["ts"]
    },
    {
      "id": "TK-N5",
      "token": "t1bwEBkvOgHC1-QJobLD1OX2BxAZLzoBwtfkGLLD1OX2Bxgmpk3YDUjmcTwPYu1Q9cpqmSPs4",
      "endpoint_type": "o",
      "expected_error": "token_malformed",
      "sides": ["ts"]
    },
    {
      "id": "TK-N6",
      "token": "t1aQEBkvOgHC1-QJobLD1OX2BxAZLzoBwtfkONTl9gcYKTpAGS86AcLX5Enl9gcYKTpLUAESIzRFVmd2VT8QBjsED8ziv9kbSLtMCehrWu",
      "endpoint_type": "i",
      "expected_error": "token_expired",
      "now": 1784995200,
      "sides": ["ts"]
    },
    {
      "id": "TK-N7",
      "token": "t1aQEBkvOgHC1-QJobLD1OX2BxAZLzoBwtfkONTl9gcYKTpAGS86AcLX5Enl9gcYKTpLUAESIzRFVmd2pk8pg7wFifQiBnNoxotJQLmO2S",
      "endpoint_type": "i",
      "expected_error": "token_already_used",
      "now": 1784995200,
      "nonce_used": true,
      "sides": ["ts"]
    },
    {
      "id": "TK-N8",
      "token": "t1bwEBkvOgHC1+QJobLD1OX2BxAZLzoBwtfkGLLD1OX2Bxgmpk3YDUjmcTwPYu1Q9cpqmSPs4g",
      "endpoint_type": "o",
      "expected_error": "token_malformed",
      "sides": ["ts"]
    },
    {
      "id": "TK-N9",
      "token": "t1bwEBkvOgHC1-QJobLD1OX2BxAZLzoBwtfkGLLD1OX2Bxgmpk3YDUjmcTwPYu1Q9cpqmSPs4g=",
      "endpoint_type": "o",
      "expected_error": "token_malformed",
      "sides": ["ts"]
    }
  ]
}
